question,text,10/Random
"Question: who painted ""sunflowers""?","Context1: Vincent van Gogh's Paintings: Vincent van Gogh was a Dutch post-impressionist painter. Among his works are some of the world's best-known and most expensive pieces, such as ""Starry Night,"" ""Sunflowers,"" and ""The Bedroom."" Question: who painted ""sunflowers""? Are follow up questions needed here: No. So the final answer is: Vincent van Gogh ###","[[(True, False)]]"
Question: who developed the theory of relativity?,"Context1: Albert Einstein: Albert Einstein was a German-born theoretical physicist who developed the theory of relativity, one of the two pillars of modern physics. He also made significant contributions to the development of the theory of quantum mechanics. Question: who developed the theory of relativity? Are follow up questions needed here: No. So the final answer is: Albert Einstein ###","[[(True, False)]]"
Question: where is the colosseum located?,"Context1: The Colosseum: The Colosseum, an ancient amphitheater located in Rome, Italy, is the largest ever built. It is considered one of the greatest works of Roman architecture and engineering. Question: where is the colosseum located? Are follow up questions needed here: No. So the final answer is: Rome, Italy ###","[[(True, False)]]"
"Question: who composed ""the marriage of figaro""?","Context1: Mozart: Wolfgang Amadeus Mozart was a prolific and influential composer of the classical era known for composing more than 600 works, including symphonies, operas, and chamber music. Question: who composed ""the marriage of figaro""? Are follow up questions needed here: No. So the final answer is: Wolfgang Amadeus Mozart ###","[[(True, False)]]"
Question: where is mount everest located?,"Context1: The Himalayas: The Himalayas are a mountain range in Asia separating the plains of the Indian subcontinent from the Tibetan Plateau. The range has some of Earth's highest peaks, including the highest, Mount Everest. Question: where is mount everest located? Are follow up questions needed here: No. So the final answer is: Himalayas ###","[[(True, False)]]"
Question: who was the first woman to win a Nobel Prize?,Context1: Marie Curie: Marie Curie was a physicist and chemist who conducted pioneering research on radioactivity. She was the first woman to win a Nobel Prize and the only person to win Nobel Prizes in two different sciences. Question: who was the first woman to win a Nobel Prize? Are follow up questions needed here: No. So the final answer is: Marie Curie ###,"[[(True, False)]]"
Question: which is the largest tropical rainforest in the world?,Context1: The Amazon Rainforest: The Amazon Rainforest is a large tropical rainforest occupying the drainage basin of the Amazon River and its tributaries in northern South America. It is the world's largest tropical rainforest. Question: which is the largest tropical rainforest in the world? Are follow up questions needed here: No. So the final answer is: The Amazon Rainforest ###,"[[(True, False)]]"
Question: who was the 16th President of the United States?,"Context1: Abraham Lincoln: Abraham Lincoln served as the 16th President of the United States from 1861 until his assassination in 1865. He led the nation through its greatest moral, constitutional, and political crisis in the Civil War. Question: who was the 16th President of the United States? Are follow up questions needed here: No. So the final answer is: Abraham Lincoln ###","[[(True, False)]]"
"Question: who wrote ""othello""?","Context1: William Shakespeare: William Shakespeare is recognized as one of the greatest playwrights and writers of the English language. His works include numerous plays like ""Hamlet"", ""Othello"", and ""Macbeth"". Question: who wrote ""othello""? Are follow up questions needed here: No. So the final answer is: William Shakespeare ###","[[(True, False)]]"
Question: which sea is almost completely enclosed by land and connected to the Atlantic Ocean?,"Context1: The Mediterranean Sea: The Mediterranean Sea is a sea connected to the Atlantic Ocean, surrounded by the Mediterranean region and almost completely enclosed by land. Question: which sea is almost completely enclosed by land and connected to the Atlantic Ocean? Are follow up questions needed here: No. So the final answer is: The Mediterranean Sea ###","[[(True, False)]]"
Question: who is credited with discovering America for Europe?,"Context1: Christopher Columbus: Christopher Columbus was an Italian explorer who completed four voyages across the Atlantic Ocean, which opened the way for European exploration and colonization of the Americas. Question: who is credited with discovering America for Europe? Are follow up questions needed here: No. So the final answer is: Christopher Columbus ###","[[(True, False)]]"
Question: where is the Taj Mahal located?,"Context1: The Taj Mahal: The Taj Mahal is a white marble mausoleum located in Agra, India. It was commissioned in 1632 by the Mughal emperor Shah Jahan to house the tomb of his favorite wife, Mumtaz Mahal. Question: where is the Taj Mahal located? Are follow up questions needed here: No. So the final answer is: Agra, India ###","[[(True, False)]]"
"Question: who painted ""the last supper""?","Context1: Leonardo da Vinci: Leonardo da Vinci was an Italian polymath of the Renaissance period. His areas of expertise included painting, drawing, engineering, science, music, mathematics, and anatomy. Question: who painted ""the last supper""? Are follow up questions needed here: No. So the final answer is: Leonardo da Vinci ###","[[(True, False)]]"
Question: what is widely considered the longest river in the world?,"Context1: The Nile River: The Nile is a major north-flowing river in northeastern Africa, commonly regarded as the longest river in the world. Question: what is widely considered the longest river in the world? Are follow up questions needed here: No. So the final answer is: The Nile River ###","[[(True, False)]]"
"Question: who composed ""symphony no. 5""?","Context1: Beethoven: Ludwig van Beethoven was a German composer and pianist, a crucial figure in the transition between the Classical and Romantic eras in classical music. Question: who composed ""symphony no. 5""? Are follow up questions needed here: No. So the final answer is: Ludwig van Beethoven ###","[[(True, False)]]"
Question: who discovered radium and polonium?,"Context1: Marie Curie's Achievements: Marie Curie is noted for her discovery of polonium and radium, and her immense contribution to the study of radioactivity. She was the first woman to win a Nobel Prize. Question: who discovered radium and polonium? Are follow up questions needed here: No. So the final answer is: Marie Curie ###","[[(True, False)]]"
Question: what was the period of renewed interest in culture and arts called in Europe?,"Context1: The Renaissance: The Renaissance was a fervent period of European cultural, artistic, political, and economic “rebirth” following the Middle Ages. It promoted the rediscovery of classical philosophy, literature, and arts. Question: what was the period of renewed interest in culture and arts called in Europe? Are follow up questions needed here: No. So the final answer is: The Renaissance ###","[[(True, False)]]"
Question: what is the largest hot desert in the world?,Context1: The Sahara Desert: The Sahara is the largest hot desert in the world and the third largest desert overall after Antarctica and the Arctic. It covers much of North Africa. Question: what is the largest hot desert in the world? Are follow up questions needed here: No. So the final answer is: The Sahara Desert ###,"[[(True, False)]]"
Question: who was the first black president of South Africa?,Context1: Nelson Mandela: Nelson Mandela was an anti-apartheid revolutionary and the first black president of South Africa. His presidency marked the end of apartheid. Question: who was the first black president of South Africa? Are follow up questions needed here: No. So the final answer is: Nelson Mandela ###,"[[(True, False)]]"
Question: where is the Amazon River located?,"Context1: The Amazon River: The Amazon River, located in South America, is the largest river by discharge volume of water in the world and possibly the longest in length. Question: where is the Amazon River located? Are follow up questions needed here: No. So the final answer is: South America ###","[[(True, False)]]"
Question: who was the first man to walk on the moon?,"Context1: Moon Landing 1969: The Apollo 11 mission was the first successful manned mission to land on the Moon on July 20, 1969, with astronauts Neil Armstrong and Buzz Aldrin. Question: who was the first man to walk on the moon? Are follow up questions needed here: No. So the final answer is: Neil Armstrong ###","[[(True, False)]]"
Question: where is the Amazon Basin primarily located?,"Context1: The Amazon Basin: The Amazon Basin covers an area of approximately 7 million square kilometers, and is home to vast biodiversity, unique ecosystems, and is mainly in Brazil. Question: where is the Amazon Basin primarily located? Are follow up questions needed here: No. So the final answer is: Brazil ###","[[(True, False)]]"
Question: who is considered the founder of modern nursing?,Context1: Florence Nightingale: Florence Nightingale laid the foundation of professional nursing with the establishment of her nursing school at St Thomas' Hospital in London in 1860. Question: who is considered the founder of modern nursing? Are follow up questions needed here: No. So the final answer is: Florence Nightingale ###,"[[(True, False)]]"
Question: who is credited with inventing the light bulb?,"Context1: Thomas Edison: An inventor of profound legacy, Thomas Edison developed many devices such as the phonograph and the electric light bulb. Question: who is credited with inventing the light bulb? Are follow up questions needed here: No. So the final answer is: Thomas Edison ###","[[(True, False)]]"
"Question: which ancient pyramids are located in Cairo, Egypt?","Context1: The Pyramids of Giza: The Pyramids of Giza are ancient pyramid-shaped masonry structures located in the Giza Plateau, Cairo, Egypt. They are the oldest of the Seven Wonders of the Ancient World, and the only one to remain largely intact. Question: which ancient pyramids are located in Cairo, Egypt? Are follow up questions needed here: No. So the final answer is: The Pyramids of Giza ###","[[(True, False)]]"
Question: who sculpted the statue of David?,"Context1: Michelangelo: Michelangelo, an Italian Renaissance sculptor, painter, architect, and poet, is known for works such as the statue of David and painting the Sistine Chapel ceiling. Question: who sculpted the statue of David? Are follow up questions needed here: No. So the final answer is: Michelangelo ###","[[(True, False)]]"
Question: where is Mount Kilimanjaro located?,Context1: Mount Kilimanjaro: Mount Kilimanjaro is a dormant volcano in Tanzania. It is the highest mountain in Africa. Question: where is Mount Kilimanjaro located? Are follow up questions needed here: No. So the final answer is: Tanzania ###,"[[(True, False)]]"
"Question: who painted ""The Last Supper""?","Context1: Leonardo da Vinci: Leonardo da Vinci was a polymath during the Renaissance who is widely acclaimed for his artworks such as ""Mona Lisa"" and ""The Last Supper."" Question: who painted ""The Last Supper""? Are follow up questions needed here: No. So the final answer is: Leonardo da Vinci ###","[[(True, False)]]"
Question: what famous ceiling was painted by Michelangelo?,"Context1: The Sistine Chapel: The Sistine Chapel is a chapel in the Apostolic Palace, the official residence of the Pope in Vatican City, and renowned for its Renaissance frescoes by Michelangelo. Question: what famous ceiling was painted by Michelangelo? Are follow up questions needed here: No. So the final answer is: The Sistine Chapel ceiling ###","[[(True, False)]]"
Question: who was the last active pharaoh of Egypt?,Context1: Cleopatra VII: Cleopatra VII was the last active ruler of the Ptolemaic Kingdom of Egypt. Question: who was the last active pharaoh of Egypt? Are follow up questions needed here: No. So the final answer is: Cleopatra VII ###,"[[(True, False)]]"
Question: who was the first woman awarded a Nobel Prize?,"Context1: Marie Curie: Marie Curie, a pioneer in the field of radioactivity, was the first woman to win a Nobel Prize and the only person to win in two different sciences. Question: who was the first woman awarded a Nobel Prize? Are follow up questions needed here: No. So the final answer is: Marie Curie ###","[[(True, False)]]"
Question: what is the longest wall built for defense in China?,"Context1: The Great Wall of China: Built for the protection against invasions, the Great Wall of China extends over 13,000 miles. Question: what is the longest wall built for defense in China? Are follow up questions needed here: No. So the final answer is: The Great Wall of China ###","[[(True, False)]]"
Question: which ancient amphitheater is an iconic landmark in Rome?,"Context1: The Colosseum: The Colosseum is an iconic symbol of Ancient Rome, used for gladiatorial contests and public spectacles. It is the largest ancient amphitheater ever built. Question: which ancient amphitheater is an iconic landmark in Rome? Are follow up questions needed here: No. So the final answer is: The Colosseum ###","[[(True, False)]]"
Question: who formulated the laws of motion and universal gravitation?,"Context1: Isaac Newton: Known for discoveries in gravitational force and motion, Sir Isaac Newton's work laid the foundation for classical mechanics. Question: who formulated the laws of motion and universal gravitation? Are follow up questions needed here: No. So the final answer is: Isaac Newton ###","[[(True, False)]]"
Question: which mountain is the highest in the world?,"Context1: Mount Everest: Mount Everest, Earth's highest peak at 8,848.86 meters, is located between Nepal and the Tibetan Autonomous Region of China. Question: which mountain is the highest in the world? Are follow up questions needed here: No. So the final answer is: Mount Everest ###","[[(True, False)]]"
Question: who is known for using nonviolence to lead India's independence movement?,"Context1: Mahatma Gandhi: Mahatma Gandhi was a leader in the Indian independence movement in British-ruled India, employing nonviolent civil disobedience. Question: who is known for using nonviolence to lead India's independence movement? Are follow up questions needed here: No. So the final answer is: Mahatma Gandhi ###","[[(True, False)]]"
Question: what is the capital of Italy?,"Context1: Rome, Italy: Rome is the capital city of Italy, known for its history as the seat of the Roman Empire and such landmarks as the Colosseum and Vatican City. Question: what is the capital of Italy? Are follow up questions needed here: No. So the final answer is: Rome ###","[[(True, False)]]"
Question: which temple is dedicated to Athena on the Acropolis in Greece?,"Context1: The Parthenon: The Parthenon is a former temple on the Athenian Acropolis in Greece, dedicated to the goddess Athena. Question: which temple is dedicated to Athena on the Acropolis in Greece? Are follow up questions needed here: No. So the final answer is: The Parthenon ###","[[(True, False)]]"
"Question: who composed ""fur elise""?","Context1: Beethoven: Ludwig van Beethoven was a German composer and pianist, with works including the Ninth Symphony and ""Fur Elise."" Question: who composed ""fur elise""? Are follow up questions needed here: No. So the final answer is: Ludwig van Beethoven ###","[[(True, False)]]"
Question: what is the first section of the Christian Bible called?,"Context1: The Old Testament: The Old Testament is the first section of the Christian Bible, based on the Hebrew Bible. Question: what is the first section of the Christian Bible called? Are follow up questions needed here: No. So the final answer is: The Old Testament ###","[[(True, False)]]"
Question: which river is considered the longest in the world?,Context1: The Nile River: The Nile River flows through northeastern Africa and is commonly regarded as the longest river in the world. Question: which river is considered the longest in the world? Are follow up questions needed here: No. So the final answer is: The Nile River ###,"[[(True, False)]]"
Question: who developed the theory known for the equation E=mc^2?,"Context1: Albert Einstein: Famous for the theory of relativity and the equation E=mc^2, Albert Einstein reshaped theoretical physics. Question: who developed the theory known for the equation E=mc^2? Are follow up questions needed here: No. So the final answer is: Albert Einstein ###","[[(True, False)]]"
Question: who formulated the three laws of motion?,"Context1: Isaac Newton: Isaac Newton, a prominent figure in physics, formulated the three laws of motion and the law of universal gravitation. Question: who formulated the three laws of motion? Are follow up questions needed here: No. So the final answer is: Isaac Newton ###","[[(True, False)]]"
Question: where is the Eiffel Tower situated?,"Context1: The Eiffel Tower: Located on the Champ de Mars in Paris, France, the Eiffel Tower is one of the most recognizable structures in the world. Question: where is the Eiffel Tower situated? Are follow up questions needed here: No. So the final answer is: Paris, France ###","[[(True, False)]]"
Question: where is the Great Blue Hole located?,Context1: The Great Blue Hole: The Great Blue Hole is a large submarine sinkhole off the coast of Belize. Question: where is the Great Blue Hole located? Are follow up questions needed here: No. So the final answer is: Belize ###,"[[(True, False)]]"
Question: who was the last pharaoh of Egypt known as?,"Context1: Cleopatra VII: Cleopatra VII was the last active ruler of the Ptolemaic Kingdom of Egypt and should not be confused with Cleopatra I or II, earlier Ptolemaic rulers. Question: who was the last pharaoh of Egypt known as? Are follow up questions needed here: No. So the final answer is: Cleopatra VII ###","[[(True, False)]]"
Question: who is known for perfecting the telescope and observing Jupiter's moons?,Context1: Galileo Galilei: Galileo Galilei was a central figure in the transition from natural philosophy to modern science and in the transformation of the Renaissance into a scientific revolution. He perfected the telescope and made significant astronomical observations including those of Jupiter's moons. Question: who is known for perfecting the telescope and observing Jupiter's moons? Are follow up questions needed here: No. So the final answer is: Galileo Galilei ###,"[[(True, False)]]"
Question: where is the Yosemite Valley located?,Context1: The Yosemite Valley: The Yosemite Valley is a glacial valley in Yosemite National Park in the western Sierra Nevada mountains of Central California. Its view includes famous landforms like El Capitan and Yosemite Falls. Question: where is the Yosemite Valley located? Are follow up questions needed here: No. So the final answer is: Central California ###,"[[(True, False)]]"
Question: who led India to independence using nonviolent methods?,Context1: Gandhi's Nonviolence: Mahatma Gandhi led the Indian struggle for independence from British colonial rule through methods of nonviolence or nonviolent civil disobedience. Question: who led India to independence using nonviolent methods? Are follow up questions needed here: No. So the final answer is: Mahatma Gandhi ###,"[[(True, False)]]"
Question: which canyon is formed by the Colorado River in Arizona?,"Context1: The Grand Canyon: Located in Arizona, USA, the Grand Canyon is a spectacular geological formation carved by the Colorado River. Question: which canyon is formed by the Colorado River in Arizona? Are follow up questions needed here: No. So the final answer is: The Grand Canyon ###","[[(True, False)]]"
Question: which rainforest is the largest in South America?,"Context1: The Amazon Rainforest: Encompassing 5.5 million square kilometers, the Amazon Rainforest is located in South America and hosts a multitude of species. Question: which rainforest is the largest in South America? Are follow up questions needed here: No. So the final answer is: The Amazon Rainforest ###","[[(True, False)]]"
"Question: which composer is known for the Ninth Symphony featuring ""Ode to Joy""?","Context1: Beethoven's Ninth Symphony: Ludwig van Beethoven's Ninth Symphony is famously known for its final movement, the ""Ode to Joy"". Question: which composer is known for the Ninth Symphony featuring ""Ode to Joy""? Are follow up questions needed here: No. So the final answer is: Ludwig van Beethoven ###","[[(True, False)]]"
Question: what is another name for the North Star?,"Context1: The North Star: Also known as Polaris, the North Star is a bright star nearly directly above the Earth's northern axis; commonly used for navigation. Question: what is another name for the North Star? Are follow up questions needed here: No. So the final answer is: Polaris ###","[[(True, False)]]"
Question: which tower is known for its unintended tilt in Italy?,"Context1: The Leaning Tower of Pisa: The Leaning Tower of Pisa is a freestanding bell tower in Pisa, Italy, known worldwide for its unintended tilt. Question: which tower is known for its unintended tilt in Italy? Are follow up questions needed here: No. So the final answer is: The Leaning Tower of Pisa ###","[[(True, False)]]"
Question: what was the main purpose of the Roman Colosseum?,"Context1: The Roman Colosseum: A historical symbol of Imperial Rome, the Colosseum was a stadium for gladiators and public spectacles. Question: what was the main purpose of the Roman Colosseum? Are follow up questions needed here: No. So the final answer is: Gladiator shows and public spectacles ###","[[(True, False)]]"
Question: where is the Amazon River Basin located?,Context1: The Amazon River Basin: The Amazon River Basin occupies much of northern South America and is home to diverse wildlife and unique ecosystems. Question: where is the Amazon River Basin located? Are follow up questions needed here: No. So the final answer is: Northern South America ###,"[[(True, False)]]"
Question: what is used to organize the chemical elements by atomic number?,"Context1: The Periodic Table: The Periodic Table is a tabular arrangement of chemical elements organized by atomic number, electron configuration, and recurring chemical properties. Question: what is used to organize the chemical elements by atomic number? Are follow up questions needed here: No. So the final answer is: The Periodic Table ###","[[(True, False)]]"
Question: which delta is formed by the Nile River in Egypt?,"Context1: The Nile Delta: The Nile Delta is a large fertile area of northern Egypt, known for its rich history and agricultural productivity. Question: which delta is formed by the Nile River in Egypt? Are follow up questions needed here: No. So the final answer is: The Nile Delta ###","[[(True, False)]]"
Question: where is Silicon Valley found?,"Context1: Silicon Valley: Located in the southern part of the San Francisco Bay Area, Silicon Valley is a global center for technology and innovation. Question: where is Silicon Valley found? Are follow up questions needed here: No. So the final answer is: Southern part of the San Francisco Bay Area ###","[[(True, False)]]"
Question: who were the first two people to land on the Moon?,"Context1: Apollo 11 Mission: Apollo 11 was the spaceflight that landed the first two people on the Moon, carried out by American astronauts Neil Armstrong and Buzz Aldrin in 1969. Question: who were the first two people to land on the Moon? Are follow up questions needed here: No. So the final answer is: Neil Armstrong and Buzz Aldrin ###","[[(True, False)]]"
"Question: who composed ""Don Giovanni""?","Context1: Wolfgang Amadeus Mozart: Mozart’s compositions encompass a synthesis of various musical elements, which include operas like ""Don Giovanni"" and ""The Marriage of Figaro"". Question: who composed ""Don Giovanni""? Are follow up questions needed here: No. So the final answer is: Wolfgang Amadeus Mozart ###","[[(True, False)]]"
Question: where are the Pyramids of Giza located?,"Context1: Pyramids of Giza: Standing as the only remaining Ancient Wonder, the Pyramids of Giza were built in ancient Egypt to serve as grand tombs for the pharaohs. Question: where are the Pyramids of Giza located? Are follow up questions needed here: No. So the final answer is: Egypt ###","[[(True, False)]]"
Question: what sea lies between Africa and Asia?,"Context1: The Red Sea: The Red Sea is a seawater inlet of the Indian Ocean, lying between Africa and Asia. Question: what sea lies between Africa and Asia? Are follow up questions needed here: No. So the final answer is: The Red Sea ###","[[(True, False)]]"
Question: who was the Queen of England during the Elizabethan era?,"Context1: Queen Elizabeth I: Queen Elizabeth I was the Queen of England and Ireland from 1558 until her death in 1603, known as the Elizabethan era, praised for her diplomacy and navigational exploration. Question: who was the Queen of England during the Elizabethan era? Are follow up questions needed here: No. So the final answer is: Queen Elizabeth I ###","[[(True, False)]]"
"Question: who painted ""The Starry Night""?","Context1: Vincent van Gogh: Afflicted by mental illness, Vincent van Gogh is still revered for his contribution to painting, transforming perspective and creativity in his pieces like ""The Starry Night"". Question: who painted ""The Starry Night""? Are follow up questions needed here: No. So the final answer is: Vincent van Gogh ###","[[(True, False)]]"
